<?xml version="1.0" encoding="UTF-8"?>
<ss:snapshot xmlns:ss="http://www.stajistics.org/StatisticsSnapshot/" 
              xmlns:xsi="http://www.w3.org/2001/XMLSchema-instance" 
              xsi:schemaLocation="http://www.stajistics.org/StatisticsSnapshot/ StatisticsSnapshot.xsd ">
  <schemaVersion>schemaVersion</schemaVersion>
  <timeStamp>2001-12-31T12:00:00</timeStamp>
  <guid>35235235</guid> <!-- a hash of the env, config? -->
  <generation>4</generation> <!-- Store the start/end timestamps of the active period? -->
  <environment>
    <system>
      <systemName>localhost</systemName>
      <properties>
        <property>
          <name>java.class.path</name>
          <value>.</value>
        </property>
      </properties>
    </system>
    <application>
      <name>Wicked</name>
    </application>
  </environment>
  <configurations>
    <configuration>
      <key><name>test</name></key>
      <trackerFactory>asdf</trackerFactory>
      <sessionFactory>asdf</sessionFactory>
      <unit>ms</unit>
      <description>test</description>
    </configuration>
  </configurations>
  <sessions>
    <session>
      <key><name>test</name></key>
      <dataSet>
        <field>
          <name>hits</name>
          <value>3</value>
          <meta>
            <attribute>
              <name>type</name>
              <value>int</value>
            </attribute>
          </meta>
        </field>
      </dataSet>
    </session>
  </sessions>
</ss:snapshot>
